clean_comment,category
 here graduated college and have job have work experience country that tolerates lgbtq people well have some friends and have people who genuinely care should finally happy right actually dying the inside have passion anymore just feel lonely despite all the people around and don even want bother looking for relationship room mess sleep pass time ditch friends just stay home and olay games engage with online friends just fill loneliness temporarily because don want out talk about problems friends have therapist and also venaflaxine which the anti depressant feel numb was working before but stopped don even have reason complain but just feel too dead living too tiring the post can see the point still insecure and hate myself much personality looks weight and not even overweight just have asian parents can happy matter how much try don even have the motivation help myself can even tell temporary happiness even genuine don know what feel like mostly got shit together but underneath there big big mess sigh too tired ,1
 hate ruin all friendships push people away don’ have enough energy jack shit meds don’ seem help just feel worthless ’ not actively suicidal just case anyone concerned just fucking hate life and genuinely wish wouldn’ wake tomorrow like don’ know how most social thing and just feel unwanted hate life ,-1
 hours hours day life that how long have allocate sleep need allocate hours per day sleep order maybe get hours sleep per night done all sleep studies sleeping pills cbt exercise meditation and masturbation meditation masturbation done all down the minutiae when bathe might affect circadian rhythm you know what learned from all that nothing ability sleep appears entirely random sure being stressed makes worse but still random anyway just throwing this out there the void for reason particular because already know won help but know there are others out there that are the same boat this small leaky boat that understand those semi functional adults that have allocate full their limited time earth just trying get enough rest stay alive throwing this out there because there are others out there like hear you even though you say nothing all hear you this saying nothing all return ,-1
 17f didn’ know which sub post this posted quite few think was raped now boyfriend 16m would like some clarity what should’ been the lookout for could’ stopped from happening basically how much was fault ’ sorry ’ long sexual assault met when was and was towards the end 2020 had just shifted apartments and was terrible place mentally had cut all friends off and was very depressed and suicidal shifted the same apartment few months later and met through mutual friend find very hard connect with people when hit off immediately felt amazing wasn’ looking for anything romantic with him initially because was younger than and wasn’ keen the idea but quickly became best friends and knew that started liking each other was very against dating because because felt like wasn’ emotionally ready and said was too started kissing and making out and soon after admitted that had feelings for each other call one night asked why aren’ dating and told him that wouldn’ end well and that the idea just icks out little but kept being like why not and have some faith agreed mind you really liked him this point was willing give shot ’ never gone past 2nd base before and ’ already had sex wasn’ much big deal him before started dating gave him head which guess gave him the get that was ready anything since lived the same apartment met everyday and after that day would kind expect everyday even when just wanted kiss was little surprised the beginning but thought was normal and didn’ want disappoint went ahead with ’ also constantly turn every conversation had especially late night into something sexual even when made clear that was uncomfortable ’ give every time because didn’ want him think didn’ like him and tried convince myself that was just because liked should’ realised then that wasn’ educated about consent but was blinded how much liked him and how good felt have someone with you that told myself that these were all normal things expect relationship had abusive childhood too love seemed different than what may for others told him wanted wait and that wanted first time special with him not said yes absolutely and many things which made trust him further although his actions showed otherwise friend 16f the time was groomed another guy our friend group 19m the time into hooking straight after her break knew that she was virgin and that she expected only making out maybe 3rd base max but penetrated her without asking for her consent happened the washroom common building our apartment and soon after she told our friend group him and talked about how horrible was and said that was awful and how disgusting was for him something like that was glad felt that way not even week later takes the same washroom were looking his old childhood pictures before that and laughing together was nice night told that had home soon and the washroom with him thought making out can’ hurt and went with him kissed and before knew had taken mine and his clothes off all remember everything moving super fast was top him kissing him when felt that was trying penetrate told him that ’ scared and that wasn’ sure but thought must’ been mistake because ’ already talked about and himself had said that didn’ want lose virginity some quickie dark washroom didn’ ask wanted before knew was inside just remember feeling completely numb mind was frozen some sort icy shock screaming what the fuck going what the fuck happening didn’ make single sound didn’ say let him continue just wanted over with towards the end pushed off him and shoved head down again resisted lifting head once but once pushed again gave got and handed clothes and started dressing himself still remember exactly what was wearing what was wearing the feeling clutching clothes chest that dark dingy washroom couldn’ speak realised something was wrong when couldn’ speak helped get dressed and kissed the forehead and asked are you didn’ say anything except push him away could tell that was getting scared what’ wrong kept asking over and over and over whatever tried speak came out whispers didn’ realise was whispering until saw him lean closer and closer catch what was trying say kept trying hold hand was heartbroken trusted him much felt dirty and disgusting and violated felt like the one thing that was truly mine this world had been taken away from for minutes someone’ gratification dropped him home was confused what had just happened called younger sister 15m before got into the lift when realised voice hadn’ come back took the phone from and told her that thinks made sad went home sister and aren’ close but have this kinship the fact ’ been through the same things together that was the first time hugged her life sobbed until was sore and she did too told her what had happened didn’ feel like myself anymore felt like the last hopeful part had been ripped away like heart had been ripped away from chest beating and bloody till eventually stopped told him not tell anyone messaged saying ’ such terrible boyfriend and that sorry and that should stab him makes feel better scrubbed myself raw the shower that night for what felt like hours trying the get the memory out skin ’ going spare you the details now but after this broke with him after couple days insisted that should still friends didn’ want lose him losing him the same time this happened would’ felt like tragedies once started dating again barely month later wished that would leave because didn’ have the strength had space myself told understood that what did was wrong and that loved when asked him how could someone who loves someone else rape them said thought wanted and that thought said was scared and don’ know because thought someone was outside comforted him because felt bad about raping told ’ get panic attacks when talked about which made stop because didn’ want make him uncomfortable then ’ ask why don’ talk him was the only one who believed him when said was accident mistake deep down knew wasn’ course like everyone else but was blinded the temporary comfort being with him provided that just didn’ matter wanted comfort from the person who caused the pain was lost was still very rocky with intense highs and much more intense lows but the highs were addictive ’ get mad when anyone suggested that our relationship was toxic were and off because friends knew about what happened and made break with him but always went back slept with him again too still pressured but this time told myself ’ doing because wanted there was one day when was sobbing thinking about front him and just smiled and told hit him get out kept trying rile didn’ want hit him just wanted cry his arms him smiling that sick way did something though and felt like fog had been lifted told friends the apartment and they begged him leave alone said she wants will knew that ’ leave once loves ever and that ’ leave once love myself being with him after was some kind self punishment knew about problems homes and with mental health ’ never ever been exposed and vulnerable single person life the one time they ask trust them and ends like this anyways don’ break but his parents find out that ’ together and being quite conservative lash out finally got some space from him contact whatsoever and realised that had break him texted him that need break and soon after that need break asked meet irl just say goodbye wanted see him one last time and still somehow hoped that ’ good terms talked 2mins and then kept trying take mask off pandemic let him and pecked like goodbye thanks for the memories peck must seem very stupid and was but ’ give anything get that naivety back after that kept trying makeout with and touch didn’ freeze this time said and pushed him multiple times said stop and put hand between moved myself away told him please sit down kept going finally dawned that was never sorry and that ’ never understand that can’ put myself harms way protect other people and make him learn because never will pushed tried force down him and screamed fuck off which was when finally hit him guess sat next didn’ know what say didn’ say anything either fell feet after while and started sobbing about how didn’ know what was wrong with him and that deserve better and please forgive him lost voice again made him promise that ’ never hurt another girl his life although the promise probably means nothing went home friends mom found out and was going tell his and stupidly again told him tell them himself because would better they heard from his mouth didn’ want him get punished just wanted him not again told them only about the recent time because apparently they would’ blame otherwise was still trying convince that was looking out for asked speak his mom and refused asked him tell them about the first time and said ’ sorry love you but this the most can for you can’ ruin life long relationship with parents told dad soon after broke him ’ abusive but know the end the day does want what’ best for asked what wanted and wanted the police after told him the whole story essentially blamed for going back him and that was really disgusted with the first time why would alone with him afterwards didn’ know how explain hopefully ’ able tell therapist and she’ explain him way ’ understand still miss him know wasn’ real but miss him much don’ know how ’ ever normal again feel unlike myself and broken thank you for reading ’ really appreciate some advice you have any ,-1
’ tired covid but ’ just tired covid19 ’ taken away much and hate wish everyone still had the determination and public interest trying bring cases essentially killing off but scientists say ’ unlikely and that ’ here stay ’ mentally tired dealing with the anxiety before the pandemic already suffered from ocd health ocd and contamination ocd ptsd from traumatic health event depression anxiety and panic disorder this was the worst thing that could have happened what happened all the progress ’ ever made destroyed don’ even want leave the house anymore and what’ worse have severe needle phobia because family has passing out risk brother has pots and mother has severe autoimmune disease that makes her faint without warning ’ afraid getting vaccinated because the needle and ’ not easy “ just have want bad enough” needle phobia causes almost react out own control don’ like but because ptsd can’ control these almost involuntary moments and responses ’ sad miss friends much and now ’ never happy ever again ever feel safe ,-1
 year old guy who has friends all have remote job don socialize all even though have good job and doing well financially not feel happy all have seen all childhood friends get girlfriends and get married and have fun and happy years old and feel like wasted teenage years and feel like wasting twenties have never really felt happy with life have never gone out and had fun with friends done any the normal things that teenagers and people age never been relationship either find really hard make new friends very insecure and find very difficult speak with women know that not and ugly guy but cant help feeling anxious and insecure when see woman find attractive have been feeling extremely lonely since 2016 when moved out the country grew but have reached new low few weeks ago decided meet with prostitute and lose virginity the experience was nothing like thought would was not able mantain erection due anxiety have been seeing the prostitute every couple days and always find very hard mantain erection and feel any pleasure the sex has been terrible but the worst part that have caught feelings for her can stop thinking about her and makes really sad know that she has sex with other men and that she doesn really care about know that falling love with prostitute extremely stupid thing but cannot control have decided block her number and not contact her again for own sanity but have been feeling extremely down and extra lonely feel like have reached the lowest point life feel like such loser for paying for sex and losing virginity prostitute and feel stupid for falling love with her just wish had normal life wish had friends could hang out with and talk about stuff and really wish had girlfriend ,-1
oddly enough feel nothing right now can’ tell this good not kind like think don’ remember anything that happened this week kind just numb and days are going fast feels nice not feel sad for once wish had more days like this sucks that this probably won’ last much longer,1
this basically how feel every day lately “ don’ want this anymore ’ tired life’ been nothing but failure and regret for years years unhappiness loneliness mistakes regret ’ been putting brave face and pretending okay but can’ anymore things aren’ going magically get better ’ failure everything how can honestly believe that after years things are going start getting better now have one fuck every friendship ’ had never had legitimate relationship try everyday get better and optimistic but ’ running out things tell myself why ’ not working who wants friends with someone like who their right mind would want date ’ ugly year old with the social skills rock care too much and overthink every fucking thing feel like don’ deserve anything good and that anything good that does happen only because luck pity that every person who talks only does out pity boredom because they have other choice ’ stuck repeat everyday the same work all week try hard hell get through the weekend rinse and repeat you know how fucking hard going bed every night and waking every morning knowing that you don’ mean shit anyone that you didn’ wake one would care even notice that things would probably better you weren’ around your workers could get more work done and become better employees without you your friends wouldn’ have deal with you every day and would happier your family doesn’ have worry about inviting you stuff that you won’ anyway because you’ too depressed anything wishing you could back and fix all your past fuck ups that girl you loved and messed everything the friends you slowly stopped talking because you weren’ the mood and they gave there’ things life ’ thankful for and take for granted everyday and hate myself for where did wrong ’ just tired wish something would way for once that would have something look forward keep going just for little while but know that’ not going happen the best part day when finally sleep after hours delaying because the minute get into bed start overthinking everything because don’ want have any dreams dreams that are good and make happy until wake and realize was only dream and that ’ nothing more than fantasy finally after hours this can finally bed finally ’ not tired for just little while ”,1
 seems lot people around age are starting find confidence and are going out taking pictures with each other hanging out are active social media ’ still insecure was high school not worse never project insecurities trying make others miserable but literally drowning internally just are there people out there who can relate,-1
ever since was kindergarten ’ wanted theatre now ’ and ’ freshman high school high school the plays are good that they’ been compared university grade productions well got first one and did frozen ’ been preparing for months and just finished ten shows the last four days was good was getting many compliments everything was doing lot ppl thought was senior usually the seniors better than the freshman and one our directors even told would going places kept good work but now that ’ all over feel empty and dark ’ had depression for years and ’ never felt alone before feel like ’ puddle disparity darkness can’ even recognize myself ’ never wanted end all before more than now part thinks ’ want this moment never end and part thinks just want attention ’ just having many rapid flashbacks head people hugging after the show the crowd screaming and cheering ’ even having related flashbacks like right now ’ sitting the edge bathtub and look over and see mom doing hair when was why feel empty when just did one the great’ things life date ,1
today for the first time self harmed with scissors and left some lines which made really scared don’ really self harm but something happened today that made angry and did regret much tho just want know will leave scars when did there’ wasn’ lot blood just bloody lines guess applied bio oil now just case any tips how make lighter ,-1
 beautiful fiance beautiful daughter both work full time both contribute evenly our bills our paid there food our fridge have inheritance future nothing outlandish but more than most people get have help with down payment for any starter house choose even have job interview next week why does nothing ever feel right then have inescapable anger and rage over the most minor things fiance and constantly fight over nothing because once reach tipping point blinded anger for days end full days where see toddler less than minutes day because don leave room you remember the beautiful ones the rat experiment that how feel most days alienated exhausted there role for other than just dad and pretty arguable she could have better father with most other people anyways adoption not partner and grew without both parents know the life hell that comes once dip but better for her listen get yelled than not just daddy can still around won blame this all covid but finally decided try and seek professional help work from don see anyone except daughter fiance and her mom rarely leave these four walls don have friends people can call and rely and besides that not fair them that only want hang out when have problem great friend when the effort put but can expect other adults with their own lives live cater attention needs can get telehealth through epa but don want that doesn feel right need setting not home and between work and logistics don have anywhere else can feel like never grew past that the worst teenage angst has stayed with forever not that can read others emotions own that don know how react them appropriately but just don when get mad shut down get quiet seclude but like bear hiding the cave you coming poking and agitating will blow guess that just bottling feelings then huh have support system put them out there anyways and even get help brought child into this world with person who not ideal partner for suck the life out her reduce her nothingness because own anger hatred and self loathing and say she undeserving feel like one person having pickup after three because she always out instead tidying home just shut about ocd would just have quietly always walking around house picking something she left somewhere toddler left somewhere don even have space put lot the junk have but can throw away because she attaches value everything got into big fight this week after being good for the last few ended when asked her what get keep forgiving her and letting her trample asked her whats for her only response was the same shitty relationship have want check out bad right now less difficult explain that parent killed themselves because they were sick than explain parent isn around because they depressed and angry and hate the world folks won have make excuses for absence just kinda rambling now guess feel like world vicious cyclone grey area that needs more explanation than worth want delete this all and just shut myself away like but know whats going happen next and much part wants disappear some sliver sanity still trying keep grasp this world tldr awful she awful have kid even aren awful the entire earth fire the sea going toxic and nobody wants talk about overpopulation guess just doing part ,-1
’ like apologize everyone struggling with their depression and anxiety ’ definitely been that person that thinks “what happened them that they can’ get their shit together ” brother died when was and while there was depression related that was ‘understandable’ and ‘acceptable’ have never before experienced the heavy blanket that just crushes “liveliness” and makes want sleep life away much better now aggressively reached out for people church and threw myself into volunteering efforts but know this not recipe for all experienced the perfect storm post covid depression recent move and huge distance from support network fortunately recovered quickly those that chronically suffer terrible burden sorry for your pain ’ not your head and you deserve just much compassion those with visible ailments god bless ,1
fuuuuuuuuuuuuuuuuuuuuuuuuuuuuuuuuuuuuuuuuuuuuuuuuuuuuuuuuuuuuuuuuuuuuuuuuuuuuuuuuuuuuuuuuuuuuuuuuuuuuuuuuuuuuuuuuuuuuuuuuuuuuuuuuuuuuuuuuuuuuuuuuuuuuuuuuuuuuuuuuuuuuuuuuuuuuuuuuuuuuuuuuuuuuuuuuuuuuuuuuuuuuuuuuuuuuuuuuuuuuuuuuuuuuuuuuuuuuuuuuuuuuuuuuuuuuuuuuuuuuuuuuuuuuuuuuuuuuuuuuuuuuuuuuuuuuuuuuuuuuuuuuuuuuuuuuuuuuuuuuuuuuck,0
why life hard when sounds simple “live life” they say but ’ all suffering ’ almost like problem for myself ’ surrounded people with perfect life but reality ’ not everyone goes through stuff but most people try hide everyone has had has bad mental state and still many live but sometimes feel like giving try better school but have motivation left try make friends but miss old ones try make family happy but fight constantly try cry but can’ try happy but can’ try love but always tend regret later ’ sick all the drama but peace too boring there always ‘but’ the way everything and ’ driving crazy trauma biggest fear even that’ what ’ used try hard get perfect life but everything holding back want look perfect want have the perfect grades want the perfect personality want the best mental state and want the perfect friends and ’ hard get all those things even though sounds easy perfect life unrealistic for person but ’ what all want isn’ the older get the more miss past even though life getting ‘better’ just feel like will never get used the updates remember all the times ’ laughed and smiled without faking and the times ’ genuinely felt happy but now ’ like nothing makes happy all worry about own life constantly and don’ know how change that imagine myself living cabin all alone with cellphone and electronics far away from everyone the middle nowhere that’ the life want but ’ scared missing old life don’ think the problem with this world live think ’ more about feelings ’ mentally exhausted easy help other people but helping myself hard and doesn’ make sense need help but ’ scared open ’ had some pretty messed experiences but still tend mess never learn and all that’ left ton scares one knows what feel and what ’ holding back from everyone don’ know anymore just feel like ’ pointless even try this point sounds cringe but bet loads people can relate ,1
 the same day all over again can can for years need die pure agony feel mental pain every moment awake,1
 just don understand how people manage fight something like depression reach out get help for just never ending cycle misery which unable break out ,-1
 one bad thing away from falling into depressive episode can you give reason stay afloat ,-1
