clean_comment,category
’ 29th youtube video the day ’ been awake for hours and most the videos ’ watched have been about minutes long ’ doing great swear ’ not but ’ fine this has all been done instead the two very simple homework assignments have ,1
recently girl told she wasn’ interested going dates anymore ’ already been feeling depressed relapsed into addiction and then went make impulsive purchases online have trash and dishes bedroom that haven’ cleaned days motivation any art writing even play games sometimes its past 4pm and finally showered and got dressed idk why ’ here guess just vent anonymous group don’ make those life worry about ,0
why feel like only intelligent people have right depressed reasons why suicidal because think fucking stupid and not competent enough for this world can hold minimal wage job can hold conversation can catch any hints did poorly school always making same mistakes every fucking time and not for lack trying try google about this issue get any advice read some posts from people who feel similiar but instead get results like dont have friends because too smart job not challenging enough wish was stupid can happy makes fucking furious know that everyone have their own problems but why feels like the one who struggles life because low intelligence really painful the stupidest person job not only always risk losing but need endure bullying feel shame mistakes and that actually okay deserve because slow and not productive enough for company work different thats how nature works tries eliminate the weak ones okay will never make lot money okay will never achieve something big get into meaningful relationship invent something called smart role model for someone but not okay for people think that less intelligent person have nothing depressed about even friends don acknowledge problems they studying college and say that exams are the real reason depressed about funny because most them well and spend most the time playing video games they don need work hard they have natural talent please don tell about the imposter syndrome that doesn matter ,1
probably nobody cares not necessarily depression only but need get this off chest not only suck university job whatever only thing sleep all day drink alcohol and kinda live money get from parents state funding for students not only hate myself especially when looking the mirror but now found guy that makes kinda happy great cute but just can this don wanna burden him with problems self pity self hatred even jealous before even being relationship because afraid being hurt again afraid will see how fucking boring actually are friends success walking train wreck who just good hiding from people and now again wasting chance because brain like you burden and not good enough however just sucks don know what ,-1
why feel like shit today have normal life stress going money work but really have reason feel sad woke this morning feeling depressed for absolutely reason thankfully had slightly busier than normal week last week apartment managed stay clean didn’ have much today managed push myself laundry today and grocery shopping but now don’ know ’ gonna eat some pizza and try and talk myself into taking shower tonight can sleep extra hour before work tomorrow but don’ feel like know other people here have lot worse things going than complaining tonight but really just wanted somewhere get feelings off chest have two friends talk that get feelings and talk but once had cut the the phone call short because her kids are being kids and needed her attention and the other didn’ answer earlier would like some you kind people maybe just have conversation with here maybe can help each other idk ,1
 all definitions loner while have one friend don frequently talk them even when groups public mind trapped state feeling isolated can help but feel like don fit with the rest the world want make this clear not and introvert don like being alone and even want reach out people knew past feel numb all the time and causes act out feel some form stimulation for example walked out the middle traffic could trigger sense fear stopped eating and have lost lot weight short period time exercise and self improvement are null wasting away have low self esteem and despite only being around the age feel like life over ,-1
self harming became satisfying enjoy looking myself bleeding think going enjoy some that tomorrow morning that when can stay totally alone,1
 need vent don talk friends family about this and overflowing right now this may come off woe but can keep this anymore and just need place release self harm and sexual assault called crisis line today sobbing and was told one could come out until tomorrow the earliest and tomorrow wasn even guaranteed haven left house about two months not eating sleeping well been crying for the last three days and just relapsed with late 20s every single time have reached out for help have been turned away some form went doctor first year university crying saying was suicidal and she pretty much told there nothing she can resources somewhere else try just nothing she could when asked could take moment get myself together since was crying she told the bathroom get doctors are busy and she probably had someone waiting come but that was the first time asked for help and her reaction made bottle and didn try access help for years after when got therapist few years ago walked into the building and burst into tears had and still never have told anyone about the sexual assault experienced childhood and walking into the appointment was terrified when was invited into the room already with tears streaming down face had ask her around \ minutes into the session for some tissues since they were across the room again she person and know she wasn withholding tissues further upset but that introduction didn make feel safe with her again bottled and got nothing out few sessions with her could but there reason this isn unique experience just exhausted can believe going feel like this for the rest life can feel like this for the rest life truly isn worth was assaulted twice when was the 8th grade and trauma response was completely bury was early 20s when remembered the first assault that how good brain was erasing and only realized the second one was assault shortly after that ever since these memories returned they play constant loop brain having fine day and all sudden back that bed paralyzed and debilitating had two best friends visit back october for the first time since covid hit and ruined one our last nights together because got sucked back and couldn snap out feel like don have any control emotions life future have money don have job and can bring myself get job because honestly what the point what working towards should have talked the people life earlier because now lack the ability courage how start this conversation when body physically rejects the words and gets stuck chest guess that what anonymity this internet for thoughts suicide are the only thing that calms down this point maybe calms down isn the right wording but more levels out reassuring that have out but promised myself wouldn while parents are alive unsure where right now mentally been crying constantly for days but don feel anything hallow haven been this place before where have these intense outward emotions and outbursts but feel nothing inside that makes sense just don know what anymore and truthfully don want anything anymore rotting away this isolated hole dug for myself and just making deeper and deeper can get out when start and attempt climb out just fall down even deeper how ask for help when don have the words just don know what don want think feel like this anymore but can get out the spiral thanks for reading tldr how you ask for help after hiding your pain for long,1
 think have ocd pick skin nonstop repeat thoughts loop all day usually ’ the things have that day that keep repeating head get very stressed when the house isn’ spotless which usually isn’ because have baby and ’ messy person and when get into something like hobby get very obsessed with and get irrationally angry when have put down and focus other things like cleaning caring for the baby etc ’ also always tired and generally very angry ’ constantly catching myself being furious with strangers for real reason worst all every few weeks have breakdown set off something small today was irritated that had many chores and how running household raising baby seems like endless string draining chores when ’ rather working hobby when was making baby food the processor leaked all over the cabinets again even though husband just fixed yesterday flipped out and spent the next few hours screaming husband and eventually said wanted divorce packed bags and left now ’ sitting car typing this don’ want divorce love husband but completely clueless how help ’ tried handful therapists but none them worked for don’ think talk therapy helpful for don’ think ’ able find therapist who gives helpful advice don’ have very many family members friends ’ terrified try antidepressant don’ want gain weight swap problems for different set problems but white knuckling isn’ working don’ know what but know can’ keep living like this does anyone have any advice suggestions ,-1
 feel worse than ’ ever felt before and think about suicide quite often don’ think would but idk ’ scared make impulsive decision one day but for some reason feel undeserving going back there would bother them would back ,-1
’ going years being diagnosed with depression ’ always been able push the back mind and sluggishly get through days five months ago best friend six years blamed for something didn’ and just stopped talking can’ explain the intensity our relationship but she was the only family had ’ been lost these past five months and losing her has caused dive deeper and deeper don’ have any other friends had mostly the same circle they left when she did can’ anything but lay around all day and fight the urge cry and don’ even know why want her back life but ’ not sure ’ possible but then ’ also pissed that ’ this disposable her because she never would have been even now laying the floor where ’ been for the last two days because don’ have energy effort don’ have appetite have drive work and failed this semester college don’ know how move forward ,1
 take 50mg quetiapine take bedtime been very long journey but can finally say hey got there please negative comments about this medication because everyone different thank you ,-1
 female have job because too mentally unwell and have help off the goverment spent teens and out hospital for overdoses and self harm was okay for while after receiving help but now just feel lost really dont have many friends and have never had relationship just feel like life pointless want have job and want normal things but just cant seem function properly without panic attacks and anxiety taking over have nobody else talk too family all think all better now and even after diagnosis still feel hopeless and confused just need know anybody out there feels the same what can feel little bit better nothing seens work,1
 freaking out tonight almost and need help terrible formulating decent paragraph problems here screenshot badly put together vent made discord png ,-1
 had really bad depression depressive early august and well into the mid november within that time lost about pounds matter four month finally was able have stable weight for about month still falling but slower but got lot comments from family and friends about and don’ like they would say “wow you look great” “ wish could look like you” ’ expressed that have depression but ’ like they don’ care makes incredibly sad when people comment weight loss when wasn’ decision made willingly there were days that wasn’ eating full meal just little snacks that still couldn’ finish was just tired move work would pretend eat because was embarrassed about eating habits idk maybe ’ being sensitive but really sucks ,1
 goes like this was quite enthusiastic and energetic years ago when was 10th grade now bachelor final year and things aren going quite good somehow have lost all feelings let say see beautiful lady like actually gorgeous but don feel the attraction towards her just even little bit don feel love for anyone neither parents nor pet just anybody same goes for anger don feel angry even someone insults defames taunts for insecurities shortcomings has caused lose relationships with family and friends only feeling left with hopelessness had several different interests like very specifically drawing videogames workout socialization tech stuf etc now lost all have absolutely ambition nor motivation anything when look former self years ago feel like absolutely different person everything these days needs very strong reason done only driving factor for work money you had seen day day life you would think pretty normal stress free guy but you know joker laugh yes sometimes laugh loud lame jokes its forceful most the time but actually funny jokes can laugh all something trigger emotions when listen some specific songs literally cry out nowhere without any reason sometimes dance like stupid attempt flush stress but doesn works quite depressed guess don know what kind depression this but know not normal all emptiness what you guys think about this you want know something you can ask ,1
today 26th birthday have idea how managed keep going for this long have friends anymore started isolating myself when was due depression family hasent come over celebrate birthday brothers have not wished happy birthday none coworkers have wished happy birthday none online buddies have wished happy birthday have pets birthdays just really show how lonely really and hate just sit here birthday cake nothing all alone home playing videogames grew somewhat happy home until mom and dad seperated when was then started moving between mom and dad frequently and thus meant never really had own room growing couldn bring friends home during childhood mom met another man after the seperation and turned out really abusive mom hit her cheated mom constantly lied about everything did shady business the side there was cop cars patrolling outside the house every now and then have been called the slur stepdad dad struggled with bills and money general for while when lived with him had hot water for while had boil water when wanted shower and one day they cut the electricity were out electricity for months had boxcutter knife placed against throat one the criminal tough boys school have recieved death threat over football match all beacuse gay out the blue boyfriend ghosted months ago and still not heard peep since was reported the police for protecting younger brother against bullies got bullied because was born fully deaf both ears and faced expulsion from the school mom had several meetings make sure wasen expelled last friend died july 2015 work job not enjoy the people work with are good but the job itself dislike but pays good keep doing still keep trying every day despite not really having anything live for not know what keeps going feels like just autopilot during most the days was taught from young age bottle emotions sorry for the long message know nobody going read this but just needed get stuff chest ,1
life just fucking trash sick and tired everything have absolutely nothing look forward ’ just all misery the only reason have been holding onto life because little brother this point don’ want him talked “his the kid whose brother killed himself” but just can’ anymore sorry bro hope you can forgive once you grow have tried end times before both times went different country france portugal and was right the edge but miraculously still here but couple days after back home depression comes back 10x harder ’ the point just existing not living anymore doesn’ help either that have gone back dysfunctional family again now plan will oslo rent apartment and swallow pills and end for good the reason travel that can far away from anyone that knows might not make sense but comforts that they don’ hear the news immediately anyways believe reincarnation hope get reborn either japan usa and loving family goodbye ,-1
 thought had gotten depression under control started lexapro decrease suicidal thoughts was doing well school and just felt better but then got bad grade and avalanche ensued going school 100 online has been hard for find harder focus the material and the lack formal lecture very unhelpful lack structure and time management school this format just exacerbates those problems but look friends coworkers family members all thriving this format know they work hard just makes feel like something wrong with was always above average student all the way through first bachelor but since going back school been completely different story confidence shattered broken and just want give don know what not where want life personally academically financially with career eats everyday but still here guess that something ,-1
 really can’ doing this shift anymore ’ running out fucking willpower not kill myself,-1
 been rough year had moderate severe depression for over ten years and not showing any signs letting attempted suicide few times damn near succeeded but attempts recently had better luck managing the ideation getting help before becomes danger though know safety plan foolproof anyway wife has been the hospital for months legally separated and own again due covid and permanent disability been going for weeks between seeing another human being person the isolation can get surprisingly oppressive introvert and like being alone just not this much guess got some friends and family including wife that talk but disconnected voice the other end call can really much the problem just far down not looking after myself not eating well sleep completely off the rails usually can sleep for days housework what that hygiene why bother and this has been ongoing for long enough that every day just gets more overwhelming when think about all the responsibilities that have piled that aren going away and one can help with living cluttered dirty house also not good for mental health and have one seriously short fuse which not like all barely managed not bite anyone head off don know because just tired muscles have finally started atrophy after months sedentary life both but started tripping over things because can seem pick foot quickly expect lost toenail thanks that next step probably falling and cracking head open something get winded walking the stairs which far cry from the running and boxing used not even driving don feel safe doing that have lots good hobbies but been floundering between them every other week seems nothing has staying power this has the knock effect making very hard part any communities surrounding those hobbies days lately consist talking wife for hour maybe talking friend for bit trying play game for half hour before get fed and then hours mindless content consumption because couldn fucked anything else not really looking for advice such but would happy commiserate with anyone who wants comment share something their own ,1
 noticed over the years that when depression getting worse the first thing that affected appetite just don feel like eating anything and never feel hungry and end eating when start feeling sick and realise that haven eaten while when end eating can only bring myself eat certain food that obsess over that point time not that find amazing just the only thing that think could eat withou making feel nauseous very specific things well right now only eat tortilla with certain type cheese before was rice and milk from certain brand think eating only certain thing gets rid the need choose and doesn put brain even more stress don know this depression thing just something deal with for other reasons was wondering anyone here can relate experience and maybe share theirs ,1
not sure this the right place posting this ’ sorry not however ’ need some advice similar stories for this topic ’ not sure actually have depressive disorder but have lot depressive tendencies although have friends paper that and ’ relationship still feel very alone get nervous asking people hang out especially because feel like burden their life and better off staying myself always feel like ’ the background the extra that nobody really cares about died today barely anyone would notice and life would just resume normal because ’ not all too important anyone begin with know ’ not perfect but really try best seem approachable and kind others and make them happy think tendency occasionally closed off large group settings due social anxiety turn off for lot people but really can’ help that ’ not looking for pity anything sincerely just advice because sit dorm room ’ college but not have roommate many nights alone and cry eyes out because feel alone and removed from the ppl find most important does anyone else feel similarly how you cope thanks advance ,1
 fall 2019 meet the love life and really mean that ’ never spent much time with any woman and genuinely enjoyed much did with her ’ weren’ dating but weren’ limited friendship least didn’ think spent almost every day together whether was person facetime shared things with her that ’ never shared with any other human being this planet ’ gotten involved physical fights over her never tell anyone family about people romantically involved with but told them about her truly thought and her would spend the rest our lives together however over time noticed started getting obsessed with her and eventually began stalking her but that’ not when things went sour stupidly started emotionally pulling away don’ know that was because knew obsessive behaviors would end ruining our relationship because deep down knew that she didn’ want with but did and when did that was when life turned shit and the depression kicked around the time our relationship deteriorating quarantine began also already wasn’ lonely enough without her covid amplified that x1000 don’ have any friends and don’ talk family about personal issues the pain felt had deal with ’ been bodybuilding for the past years thought focussing primarily that would end the pain… didn’ every now and then would interact but was occasion then when shit got really dark was when saw her prom pictures even though stopped stalking her physically never stopped cyber stalking she was with her new boyfriend this resulted having mental breakdown wasn’ the first time had breakdown over her cried all night wondering why had see that what does have that don’ then accepted the fact that she never felt the same way about that’ when decided was going kill myself then went and got dads gun and held head cried and cried when finally pulled the trigger nothing happened was because the gun was safety after some more crying decided wasn’ going follow through with after that dark period life like other began started self harming various ways wondering why had witness her love with someone who wasn’ eventually got over and her thought just once stopped self harming and thought the depression was ending went schools open house for senior year there talked her and learned had class together after she told that thought this was going some sort miracle divine intervention believed that this would when and her rekindle our relationship once school started realized this was way worse and her hang around different crowds she has clicky friend group don’ have friends all never interacted and constantly saw her class was flirting with this guy seeing that started whole new wave depression began self harming again and eventually attempted suicide again this time tried hang myself with extension chord second real attempt failed the wood pole hang the extension chord from snapped the cycle continued stalking her self harming and eventually thinking got over her didn’ now more time has passed and saw something earlier that ruined was tiktok her and old friend mine announcing their relationship and really thought the pain felt when saw her with her boyfriend was bad seeing that made realize there’ point continuing this endless cycle pain… ’ going give myself two more days before kill myself these next two days can’ get over her and become happy again won’ going kill myself through can’ fail this one when close eyes all can see her smile and all can hear her voice ’ tired not being able with her and life isn’ worth living without her for anyone who read this its entirety ’ sorry for the grammatical errors ’ currently cutting myself and crying,-1
 have been avoiding all kinds situations that may lead hace fun whatch somethinh fun hang out even have laugh its like not know how there voice within that says “youre not allowed laugh” and feel pretty akward does anyone experiencw something similar being sad motherfucker its like new identity and cannot rub away from used smile and laugh all the time work wss the girl who always smiles thanks the pandemic current state hidden off thanks god,1
