clean_comment,category
 understand that most people who reply immediately with invitation talk privately mean only help but this type response usually leads either disappointment disaster usually works out quite differently here than when you say anytime casual social context have huge admiration and appreciation for the goodwill and good citizenship many you who support others here and flag inappropriate content even more because know that many you are struggling yourselves hard work behind the scenes more information and resources make easier give and get quality help here this just small start our new wiki page explains detail why much better respond public comments least until you gotten know someone will maintained depression wiki private contact and the full text the current version below anyone who while acting helper invites accepts private contact pms chat any kind offsite communication early the conversion showing either bad intentions bad judgement either way unwise trust them anytime seems like kind and generous offer and might perfectly well meaning but unless and until solid rapport has been established just not wise idea here are some points consider before you offer accept invitation communicate privately posting supportive replies publicly you help more people than just the your responses are good quality you educate and inspire other helpers the rule rule internet culture\ applies here much does anywhere else the internet people who are struggling with serious mental health issues often justifiably have low tolerance for disappointment and high level ever changing emotional need unless the helper able make 100 commitment there for them every way for long necessary offering personal inbox resource likely more harm than good this why mental health crisis line responders usually don give their names and callers aren allowed request specific responders much healthier and safer for the callers develop relationship with the agency whole analogously much safer and healthier for our ops develop relationship with the community whole even trained responders are generally not allowed work high intensity situations alone partly about availability but mostly about wider perspective and preventing compassion fatigue helper gets over their head with someone whose mental health issues including suicidality which often comorbid with depression escalate conversation much harder for others including the depression and suicidewatch moderators help contrary common assumptions moderators can see police pms our observation over many years the people who say the most are consistently the ones with the least understanding mental health issues and mental health support all have gaps our knowledge and our ability communicate effectively community input mitigates these limitations there reason why someone who truly here help would want hide their responses from community scrutiny helpers are concerned about their own privacy keep mind that self disclosure when used supportively more about the feelings than the details and that have problem here with the use alt throwaway accounts and have restrictions account age karma all know the internet used some people exploit abuse others these people want hide their deceptive and manipulative responses from everyone except their victims there are many them who specifically target those who are vulnerable because mental health issues helper invites talk privately and gives them good supportive experience they primed that person more vulnerable abusers this sort cognitive priming tends particularly effective when someone state mental health crisis when people rely more heuristics than critical reasoning ops want talk privately posting wide open anonymous forum like reddit might not the best option although don recommend allow ops request private contact when asking for support you want this please keep your expectations realistic and have careful look the history anyone who offers before opening them ,1
welcome depression check post place take moment and share what going and how you are doing you have accomplishment you want talk about these shouldn standalone posts the sub they violate the role model rule but are welcome here are having tough time but prefer not make your own post this place you can share also like draw your attention our reformatted rules depression about rules which soft launched few months ago part that developed two detailed wikis with lots reference information depression wiki what depression provides guidance about what and isn depressive disorder guidance the complex nature the illnesses that are usually grouped under the depression label and redirect information for common off topic issues depression wiki giving help offers information the nature and value peer support for mental health issues general and lots guidance how and how not offer help and support here ysk that the types rule violations that cause the most trouble here are people breaking the private contact rule you should never trust anyone who tries get you into private conversation response post here see depression wiki private contact here help posts this shows that you don understand the most basic principles peer support especially selectivity the giving help wiki explains more about this general interest posts posts about causes issues all these are either off topic rule activism rule role modelling achievement advice posts this expert free zone that what peer support means rule know that internet culture celebrate not just bragging about your achievements but bragging about your good intentions nothing like that ever acceptable here off topic posts about difficult situations circumstances including interpersonal losses grief sadness anger and other difficult emotions are not mental illnesses the what depression wiki has suggestions for other places post about these issues which are 100 valid and serious but inappropriate here ,1
 don want but long term girlfriend hates and hate too trying really hard trying better cooked meal today cleaned and showered and even went thanks,-1
having keep eyes wide open until they burn get one single tear isn even worth the moment close them they immediately stop,1
"’ reposting here since nobody replied the other subreddit hey ’ been going therapy for some months and tbh don’ think therapist dumb that she can’ her job but sometimes get the feeling that she doesn’ want admit that she doesn’ have the tools help have both eating disorder and severe depression but ’ learned deal with the eating disorder meaning that yeah ’ there but doesn’ consume all time and energy like used ’ borderline anorexic not severely underweight but still heavily restrict but don’ starve myself depression the other way truly eating alive the past few months ’ been progressively isolating myself and lost the ability focus the simplest things ’ consumed the guilt and despair because feel like ’ not charge thoughts and actions wish had the energy focus passions and studies but everything that isn’ lying bed seems too hard and difficult and therapy weekly talk about this ’ made clear therapist that can’ seem feel better and desperately need find way recover some energy but she almost always shift the conversation back eating disorder the relationship with family which isn’ what want talk about what truly ruining daily life
she’ very anti psychiatry and anti depressants way too since experience with psychiatrists and meds has been only disappointing have taken antidepressants for years and they have never done anything help mood but somewhat get the feeling that she doesn’ really know how truly help instead she chooses focus what she thinks she can help with paranoid you think that this can happen for therapists “prideful” admit they can’ help one their patients ",-1
 friend very depressed and been having suicidal thoughts lately ’ stalled him for few days not through with today says planning leaving his home midnight leave which know means the job his parents don’ like and don’ remember his parents names nor address doesn’ live the same town don’ know should call 911 try reaching out his parents only know their last name don’ know what and truly care about this friend went therapy before but the therapist was help any recommendations what doesn’ understand how much care and matters keep telling him that over text but “doesn’ care” don’ want loose someone was close haven’ seen each other about years but went high school together please any recommendations can help ,-1
 freak out anytime start feel little down melancholy because brain automatically wants brace for tsunami hit you know the type depression where you can get out bed without feeling like you die the passive suicidal thoughts the apathy and the despair the isolation and the lack energy function human being surviving blob cells and tissue wanting anywhere but planet earth just the thought having through again puts panic ,-1
 really question myself this lot times mean how you explain this have good family well off love crysis have friends and all but the end can just get rid this pit heart not that don smile laugh and all but nowadays more then ever this feeling keeps growing more and more felt suicidal once and almost acted the 2nd time tried tell them friends but they brushed off there lot things that want write but just feel complicated can discribe them words now guess writing this just maybe someone can tell this that normal feel this ,1
 have struggled with clinical depression for many years after any argument have matter how minor whether with parents friends fall into depressive hole basically until gets resolved and until get over for example lately whenever and argue can’ come resolution cry nonstop and get depressed until figure out triggers other parts depression makes self shame self hate this can last for hours days end depending whether figure out both decide sulk and neither apologizes this normal feel horrible for putting through this gets super down too usually see depressed struggles with some form depression too hate wish wasn’ like this and wish could control better don’ want put anyone else through this just because have depression don’ know what anymore seems more like problem than anything any words comfort advice are much appreciated ,-1
 think might just kill myself hate myself this mental low want stop feeling like this ’ tired want this over tried half assed cutting earlier not very deep but ’ tired sorry lol,-1
they ask feel like being punished fucking deserve deserve worse the truth need punished more everybody agrees with this just justice wrong think otherwise ,-1
 tired feeling tired ,-1
 got diagnosed with ghsv1 genital herpes last week had outbreak and depressed and hopeless look the mirror and feel pure disgust showers arent the same feel dirty matter how much scrub saddens know never the same girl ever again she gone dating will nightmare 10x harder than was before this was like the nail the coffin for love life have always been insecure about looks and was working hard this year more positive and work self confidence self esteem but then this happens has made take steps backwards feel like life hates can even remember the last time was genuinely happy was therapy for past traumas and depression way before got diagnosed and now feel like have fight extra hard happy with this new but tired tired fighting happy feel beautiful feel loved and important tired feel defeated and helpless hope there cure lifetime the next few years  praying and hoping,1
’ like someone talk ’ just feeling pretty down the moment,1
because depression have will energy anything unless forced every morning wake and just lay bed for hours with thoughts that kill and starve because ’ drained don’ have will get even ’ get food glass water even though have glass bedside table just don’ have the energy reach across and get started starving and then binging lot because which really bad for you but just don’ have the will get and eat drink but parents just dismiss lazy because they don’ think kids teens can depressed they think mental disorders and emotions have age and don’ really know what ’ kinda just stuck feeling helpless this was kinda just vent but you have advice give love hear ,-1
when someone dies everyone like they better place now they longer suffering but try send myself that better place longer have suffer they say sinful and selfish and cowardly and course soon ahead and actually better place now longer suffering what the fuck you really cared about you let could relieved agony but all you want assuage your conscience and tell yourself that not your fault fuck you loved ones you don give fuck about you just want keep alive for your own selfish reasons when you know that better place and better because you not there ,1
 always hear people saying you need love yourself first order for someone else love you and that other people can make you happy you need find happiness within yourself just can understand this concept father always used say was happy work hard and good man can good provider and role model the family would that have happened didn have wife and kids honestly doubt maybe would been alcoholic because couldn find purpose the world yea wish could find someone with whom can share some intimacy and genuine moments away from all the the world and all the superficiality someone who reciprocates trust and love sincerely think would motivate better would love spend lazy evenings the bed the couch watching movie and laugh silly scenes and debate the movie afterwards have dinner dates where cook together outside for walks nature and parks then sit bench the grass and talk about life travel bit and generally try new activities which are more enjoyable pair not mention the sexual intimacy you can get such relationship depressing want offer all this love and realize one wants give you chance btw year old guy ,1
don get wrong never thought write this sub because who would like depression seriously normally traveler and been traveling since now used energetic risk lover fearless adventure lover climbing and hiking planting trees bla bla even used secretly chase wild animals woods observe them have two profession being tour guide and linguistic used watch documentaries and take notes sometimes writing little shitty poems but after the covid lockdown periods became lazy person dead person easily tired keep delaying all real life goals playing video games sitting for many many hours can control money like used feel like shit less interested everything used adore and love was seeing very bright future ahead but something happened and feel like can fill the quota that have set for myself rolling the bed watching the ceiling and just thinking about how everything sucks been through same processes life but never been lazy like this know get out this but not going away while keep laying down bed any nice suggestion appreciated and will taken seriously ,1
does anyone else drive around aimlessly after work school just avoid going home for little bit ,-1
idk anyone else feels this way but sometimes feel bad that therapy just talking for large amount time feel like such hog taking too much space and sometimes wish was more balanced but know that kinda defeats the point therapy idk would love know what alls thoughts are ,1
 and literally tired all day everyday sleep late and get late but even when try change that still the same drive anything need finish coursework for university and due next week tried for hours but just watched youtube video and fell asleep still went for walk today try walk least hour day used the gym and cardio too but haven bothered going don really eat much but even when still feel the same most days stressed mentally due past abuse this leads high anxiety social anxiety overthinking paranoia which turn probably wears out and makes tired wake sometimes and feel disappointed just want sleep forever got symptoms cptsd and depression and getting assessed next month phycologist none family know and want stay that way anyone else ,-1
hello all anyone able give advice how best support girlfriend who struggles greatly with depression currently making sure that our home clean and trying best make lunch for her every day and listening when she open talking but need some help supporting her better she doesn’ have any family lean and she has hard time reaching out friends you could snap your fingers and have your partner one thing support you best through depressive episodes and every other day what would ,1
been about weeks since last had genuine smile the ones have today are please others feeling shit not get that normal every now and then but for years felt like everyone better off without their lives ending selfish people love but also not ending selfish too because people are better off without then staying here doing more harm ‍♂️ don know loneliness ,1
 son means absolutely everything and couldn let him grow without dad but damn depressed right now haven felt like this since days living with abusive parents work has recently fucked don know what just want cry and get all out but have nobody talk express myself well what ,-1
 boy who has friends and boring life only goal right now move spain because love the country and hope that move there have morale boost and hopefully will able something with life because here romania can find any motivation anything important know guy who moved spain and now lives madrid and makes jealous everytime talk him what depressing the most that have money even there and find job make some have force myself work everytime due the lack motivation and even end spain what would how would get job where would stay anyway thanks for reading story think this subreddit the only place could have told these things someone since basically have one talk hope someday spanish citizen least there that really not possible saludos todos los españoles and have nice day adiós ,1
’ being bombarded with suicidal ideation any you have good reasons stay alive have people love like parents best friends and boyfriend… but tired don’ want this anymore ,1
title really sums but just wanted reach out the community for little support been struggling with mild depression for over year now primarily centered around fear death existential crisis type feelings etc seen therapist off and over the last year for currently seeing one now family very suddenly lost year old mother last week heart attack and its been tough everyone lucky enough have amazing support system family friends and incredible fiancée but sometimes just not quite enough most friends and family are several states away back home california colorado and while traveling back home see them all next week just feel like could use little outside support and encouragement never easy losing loved one let alone when sudden add that already heavy struggle with the idea death and feels crushing times ,1
 anyone has min talk that will good ,1
 have friend that talk daily always there for her listen whenever she feeling bad and best support her struggling myself but trying best not burden those around however there days when gets too painful and really need someone talk noticed that after talk about feeling down she often grows distant for few days makes sad because she closest friend and can trust anyone else with those feelings,-1
 used atleast average quick thinking and awareness and everything cognitive but the last year been feeling worse and worse idk was actually this stupid all along and only realising now total loss faith and interest has lowered competence everything either way just know that this literal descent and one ever just grew wings while falling scared ,-1
but can’ maybe just don’ know what that will better than staying home and not doing what non depressed people all day anyway what that drive that they have fill their days with meaningful activities even with non meaningful activities wish knew what with free time that isn’ staying home and staring phone but just don’ wish had curiosity about the world around and wanted explore don’ wish cared about finding community and connecting with others care theory but practice nope here’ another lost sunday ,1
 have one talk about how feel nobody ask for help don know when thinking rationally being too hard myself want get but don know how considered online dating but pretty sure that only works for attractive people have note phone with things hate about myself have texts from abusive the only person who ever made the mistake dating want happy but don deserve won let myself don even know where going with this don even know leave this not hate myself hate body hate face hate that can even walk straight hate lack strength both emotional and physical hate that can anything right matter how hard try hate that always hurt the people closest hate ,-1
but instead developed feel numb towards pretty much everything and anything and literally can’ stand the fact that have get every single day and live don’ enjoy anything that life has offer don’ care about being rich and having nice things that stuff doesn’ motivate all life all want not have deal with the fact gotta pressure and force myself everyday care about existing when reality don’ care about being here all not even little bit,1
 year old man and dealt with depression and anxiety for basically entire life manifested itself fits rage anxiety attacks panic attacks overwhelming sadness and long bouts inaction and laziness have hard time maintaining and creating friendships and while can chalk some that own natural introversion and long term friends being busy with careers and kids now but has become huge problem that really getting down lately background info the end 2020 moved california honestly the move was originally try and kindle flame long distance relationship but even after that didn work out was good spirits was proud myself for making big decision doing myself driving across the country alone loved the weather and lifestyle the area anxiety and depression were generally more bay than they have ever been but once things weren going work out with this person knew had tried finding affordable places live the area but even roommate situations were just priced out control moved back home all the way back the other side the country first was extremely sad and bitterly disappointed quickly put things into perspective understanding that the important thing was taking the chance and really making change life even didn work out don regret this lifted for while and was connecting with couple old friends and family even started making couple new friends through old friends but lately seemingly lost the ability have emotional connections with anyone everything feels disturbingly surface level the woman moved across the country for and had very deep connection talked about philosophies politics our feelings and emotions our pasts would always talk about really deep things here feels like can get that level with anyone afraid talk about real feelings with anyone don want anyone know hurting become very disappointed people and instead talking about keep them arm length having hard time trusting anyone worst days feel really alone the world have put these walls and unsure how allow them broken down not sure what looking for advice something else helps write out either way having impossible time connecting with anyone very sad about ,-1
’ terribly alone within the past years isolated myself and find myself with very little friends and definitely spend many days time talking one ’ weird middle space though where definitely feel lonely long belong but don’ have the mental stability even try belong right now can only describe trying make friends talking old ones acting like ’ forcing eyes wider and holding grin and working overload try come with the words pretend invested ’ not even social anxiety just see how fake social situations are its entirety and ’ just losing hope caring ,-1
woke today telling myself something productive 1pm 1pm came and said 3pm now long past 3pm and haven done anything but laid bed mindlessly watching random vodeos all day,-1
 sure all experienced the incredible boredom from depression taking our hobbies but don hear lot talk about how intensely uncomfortable feels entire body aches and feel like going detonate nothing can scratch that itch and its driving insane usual just feel tired but sometime get into one these states where just feels intensely uncomfortable like something trying claw its way out and something anything all its like all the motivation that usually eludes coming all once and nothing can possibly satisfy ,-1
